{
  "schema_version": "1.0.0",
  "id": "recommendation-import-dv200",
  "assay_project_id": "assay-demo-ffpe",
  "source_type": "READINESS",
  "source_id": "assay-demo-ffpe",
  "rule_id": "FEASIBILITY.RNA_QUALITY_REQUIRED",
  "recommendation_type": "IMPORT_METADATA",
  "title": "Import sample-level RNA quality metadata",
  "summary": "Add DV200 values before designing the input/degradation experiment.",
  "why": "Input effects cannot be interpreted cleanly when RNA degradation is unmeasured.",
  "what_it_resolves": "The missing degradation covariate in feasibility planning.",
  "stage": "FEASIBILITY",
  "priority": 10,
  "requirement_level": "STRONGLY_RECOMMENDED",
  "status": "OPEN",
  "required_inputs": ["sample_metadata_with_dv200"],
  "expected_output": "An updated feasibility readiness result.",
  "proposed_action": {"action_type": "OPEN_METADATA_MAPPING", "launch_automatically": false},
  "evidence_refs": [{"type": "readiness_rule", "id": "FEASIBILITY.RNA_QUALITY_REQUIRED"}],
  "assumptions": ["DV200 is available or can be measured."],
  "limitations": ["Retrospective metadata cannot repair randomization or blocking."],
  "alternative_action_ids": [],
  "scientist_decision_required": true,
  "created_at": "2026-07-18T12:00:00Z",
  "resolved_at": null
}
